{
  "schema": "peercompute.ulg.material-property-bank.elements.v0",
  "schemaVersion": 1,
  "bankFamily": "elements",
  "generatorFingerprint": "ulg:f158e645",
  "generatedAt": "2026-06-19T00:00:00-08:00",
  "records": [
    {
      "schema": "peercompute.ulg.material-property-bank.element.v0",
      "symbol": "H",
      "name": "Hydrogen",
      "atomicNumber": 1,
      "atomicMassU": 1.008,
      "referenceState": {
        "temperatureK": 293.15,
        "pressurePa": 101325
      },
      "phases": [
        {
          "name": "gas",
          "temperatureRangeK": [
            13.99,
            2000
          ],
          "densityKgPerM3": 0.08375,
          "heatCapacityJPerKgK": 14300,
          "thermalConductivityWPerMK": 0.1805,
          "bulkModulusPa": 101325,
          "shearModulusPa": 0,
          "dynamicViscosityPaS": 0.0000088,
          "surfaceTensionNPerM": 0
        }
      ],
      "transitions": [
        {
          "name": "boiling",
          "temperatureK": 20.271,
          "latentHeatJPerKg": 445000
        }
      ],
      "mechanics": {
        "mlsMpmMaterialClass": "gas",
        "targetNeighborCount": 32,
        "initialPackingHint": "gas-cell-ledger",
        "spacingPolicy": "derive-from-eos-volume-not-lattice"
      },
      "opticalPbr": {
        "baseColorSrgb": [
          0.92,
          0.96,
          1
        ],
        "metalness": 0,
        "roughness": 0.15,
        "ior": 1.000132,
        "emissiveHint": "none"
      },
      "provenance": [
        {
          "family": "identity",
          "source": "periodic-table-standard-atomic-weight",
          "method": "checked-in-precomputed-seed",
          "status": "precomputed-json-bank",
          "units": "u",
          "referenceState": "neutral atom"
        },
        {
          "family": "phase-thermal-optical",
          "source": "standard-reference-data-seed",
          "method": "manual seed for resolver cache bootstrap",
          "status": "reference-fallback",
          "units": "SI",
          "referenceState": "293.15 K, 101325 Pa",
          "quality": "bootstrap-only"
        }
      ]
    },
    {
      "schema": "peercompute.ulg.material-property-bank.element.v0",
      "symbol": "Li",
      "name": "Lithium",
      "atomicNumber": 3,
      "atomicMassU": 6.94,
      "referenceState": {
        "temperatureK": 293.15,
        "pressurePa": 101325
      },
      "phases": [
        {
          "name": "solid",
          "temperatureRangeK": [
            0,
            527.904155716
          ],
          "densityKgPerM3": 344.026517895,
          "heatCapacityJPerKgK": 3194.88117603,
          "bulkModulusPa": 8768249371.87,
          "shearModulusPa": 4046884325.48,
          "dynamicViscosityPaS": null,
          "surfaceTensionNPerM": null
        },
        {
          "name": "liquid",
          "temperatureRangeK": [
            527.904155716,
            1000000
          ],
          "densityKgPerM3": 338.969328082,
          "heatCapacityJPerKgK": 3418.52285835,
          "bulkModulusPa": 8639356106.1,
          "shearModulusPa": 0,
          "dynamicViscosityPaS": null,
          "surfaceTensionNPerM": null
        }
      ],
      "transitions": [
        {
          "name": "melting",
          "temperatureK": 527.904155716,
          "latentHeatJPerKg": 632455.240649
        }
      ],
      "mechanics": {
        "mlsMpmMaterialClass": "alkali-metal",
        "targetNeighborCount": 64,
        "initialPackingHint": "bcc-metal-solid",
        "spacingPolicy": "derive-from-rest-density-and-phase"
      },
      "opticalPbr": {
        "baseColorSrgb": [
          1,
          0.947411802993,
          0.927540935069
        ],
        "metalness": 1,
        "roughness": 0.34,
        "ior": null,
        "emissiveHint": "blackbody-when-hot"
      },
      "provenance": [
        {
          "family": "identity",
          "source": "periodic-table-standard-atomic-weight",
          "method": "checked-in-precomputed-seed",
          "status": "precomputed-json-bank",
          "units": "u",
          "referenceState": "neutral atom"
        },
        {
          "family": "phase-mechanics-optical",
          "source": "ulg-element-material-closure-reduced-estimate",
          "method": "precomputed elementMaterialClosure output from atomic DFT, jellium/radial-density packing, Debye, Lindemann, Richards, and optical closure models",
          "status": "reduced-estimate",
          "units": "SI",
          "referenceState": "293.15 K, 101325 Pa",
          "quality": "bootstrap-only"
        }
      ]
    },
    {
      "schema": "peercompute.ulg.material-property-bank.element.v0",
      "symbol": "Be",
      "name": "Beryllium",
      "atomicNumber": 4,
      "atomicMassU": 9.0122,
      "referenceState": {
        "temperatureK": 293.15,
        "pressurePa": 101325
      },
      "phases": [
        {
          "name": "solid",
          "temperatureRangeK": [
            0,
            1926.61353289
          ],
          "densityKgPerM3": 541.854340119,
          "heatCapacityJPerKgK": 1936.47644206,
          "thermalConductivityWPerMK": 0,
          "bulkModulusPa": 38812507771.1,
          "shearModulusPa": 17913465125.1,
          "dynamicViscosityPaS": null,
          "surfaceTensionNPerM": null
        },
        {
          "name": "liquid",
          "temperatureRangeK": [
            1926.61353289,
            1000000
          ],
          "densityKgPerM3": 533.889081319,
          "heatCapacityJPerKgK": 2072.02979301,
          "thermalConductivityWPerMK": 0,
          "bulkModulusPa": 38241963906.9,
          "shearModulusPa": 0,
          "dynamicViscosityPaS": null,
          "surfaceTensionNPerM": null
        }
      ],
      "transitions": [
        {
          "name": "melting",
          "temperatureK": 1926.61353289,
          "latentHeatJPerKg": 1777452.36503
        }
      ],
      "mechanics": {
        "mlsMpmMaterialClass": "alkaline-earth-metal",
        "targetNeighborCount": 64,
        "initialPackingHint": "close-packed-alkaline-earth-solid-estimate",
        "spacingPolicy": "derive-from-rest-density-and-phase"
      },
      "opticalPbr": {
        "baseColorSrgb": [
          1,
          0.948628582883,
          0.929494122159
        ],
        "metalness": 1,
        "roughness": 0.42,
        "ior": null,
        "emissiveHint": "blackbody-coupled"
      },
      "provenance": [
        {
          "family": "identity",
          "source": "periodic-table-standard-atomic-weight",
          "method": "checked-in-precomputed-seed",
          "status": "exact-constant",
          "units": "u",
          "referenceState": "neutral atom"
        },
        {
          "family": "phase-mechanics-optical",
          "source": "elementMaterialClosure",
          "method": "atomic lower-level closure reduced estimate, gridPointsN=80",
          "status": "reduced-estimate",
          "units": "SI",
          "referenceState": "293.15 K, 101325 Pa",
          "quality": "bootstrap-only",
          "inputHash": "ulg:cdade4aa"
        }
      ]
    },
    {
      "schema": "peercompute.ulg.material-property-bank.element.v0",
      "symbol": "B",
      "name": "Boron",
      "atomicNumber": 5,
      "atomicMassU": 10.81,
      "referenceState": {
        "temperatureK": 293.15,
        "pressurePa": 101325
      },
      "phases": [
        {
          "name": "solid",
          "temperatureRangeK": [
            0,
            4491.16450825
          ],
          "densityKgPerM3": 935.293870426,
          "heatCapacityJPerKgK": 1036.75048147,
          "thermalConductivityWPerMK": 0,
          "bulkModulusPa": 130198721657,
          "shearModulusPa": 60091717688,
          "dynamicViscosityPaS": null,
          "surfaceTensionNPerM": null
        },
        {
          "name": "liquid",
          "temperatureRangeK": [
            4491.16450825,
            1000000
          ],
          "densityKgPerM3": 921.54505053,
          "heatCapacityJPerKgK": 1109.32301518,
          "thermalConductivityWPerMK": 0,
          "bulkModulusPa": 128284800449,
          "shearModulusPa": 0,
          "dynamicViscosityPaS": null,
          "surfaceTensionNPerM": null
        }
      ],
      "transitions": [
        {
          "name": "melting",
          "temperatureK": 4491.16450825,
          "latentHeatJPerKg": 3454358.87401
        }
      ],
      "mechanics": {
        "mlsMpmMaterialClass": "metalloid-condensed-element",
        "targetNeighborCount": 64,
        "initialPackingHint": "covalent-network-solid-estimate",
        "spacingPolicy": "derive-from-rest-density-and-phase"
      },
      "opticalPbr": {
        "baseColorSrgb": [
          1,
          0.949120630319,
          0.930184600582
        ],
        "metalness": 0.35,
        "roughness": 0.55,
        "ior": 1.5,
        "emissiveHint": "blackbody-coupled"
      },
      "provenance": [
        {
          "family": "identity",
          "source": "periodic-table-standard-atomic-weight",
          "method": "checked-in-precomputed-seed",
          "status": "exact-constant",
          "units": "u",
          "referenceState": "neutral atom"
        },
        {
          "family": "phase-mechanics-optical",
          "source": "elementMaterialClosure",
          "method": "atomic lower-level closure reduced estimate, gridPointsN=80",
          "status": "reduced-estimate",
          "units": "SI",
          "referenceState": "293.15 K, 101325 Pa",
          "quality": "bootstrap-only",
          "inputHash": "ulg:b6b803b0"
        }
      ]
    },
    {
      "schema": "peercompute.ulg.material-property-bank.element.v0",
      "symbol": "C",
      "name": "Carbon",
      "atomicNumber": 6,
      "atomicMassU": 12.011,
      "referenceState": {
        "temperatureK": 293.15,
        "pressurePa": 101325
      },
      "phases": [
        {
          "name": "solid",